[
  {
    "evidence_id": "ev_8a3f2c1d9e4b7a6f",
    "source_url": "https://www.dol.gov/newsroom/releases/eta/eta20241215",
    "title": "Department of Labor Announces $100 Million in Registered Apprenticeship Grants",
    "excerpt": "The U.S. Department of Labor announced $100 million in grants to expand Registered Apprenticeship programs in high-demand industries including electrical, HVAC, and construction trades. This investment is part of the Biden Administration's commitment to building pathways to good-paying jobs.",
    "summary": "DOL announces major funding for electrical apprenticeship expansion as part of infrastructure workforce initiative.",
    "relevance_tags": ["federal_funding", "apprenticeship", "electrical_training", "DOL"],
    "confidence": 0.92,
    "retrieved_at": "2025-12-29T06:00:00Z",
    "published_date": "2024-12-15",
    "content_hash": null,
    "archive_path": null,
    "created_at": "2025-12-29T06:00:00Z",
    "updated_at": "2025-12-29T06:00:00Z"
  },
  {
    "evidence_id": "ev_7b4e3d2c8f5a9b1e",
    "source_url": "https://www.energy.gov/articles/doe-invests-45-million-clean-energy-workforce",
    "title": "DOE Invests $45 Million in Clean Energy Workforce Training",
    "excerpt": "The Department of Energy is investing $45 million to train workers for clean energy jobs, with a focus on solar installation, EV charging infrastructure, and electrical grid modernization. The funding targets community colleges and union training programs.",
    "summary": "DOE funding targets electricians for clean energy transition jobs.",
    "relevance_tags": ["federal_funding", "clean_energy", "electrical_training", "DOE"],
    "confidence": 0.88,
    "retrieved_at": "2025-12-29T06:00:00Z",
    "published_date": "2024-11-20",
    "content_hash": null,
    "archive_path": null,
    "created_at": "2025-12-29T06:00:00Z",
    "updated_at": "2025-12-29T06:00:00Z"
  },
  {
    "evidence_id": "ev_6c5f4e3d7a8b2c9d",
    "source_url": "https://cloud.google.com/blog/topics/sustainability/google-workforce-development",
    "title": "Google Commits $15 Million to Data Center Workforce Training",
    "excerpt": "Google announced a $15 million investment in workforce development programs to train electricians and technicians for data center construction and operations across the Midwest. The initiative partners with community colleges in Illinois, Iowa, and Ohio.",
    "summary": "Google funding electrician training for data center buildout in IL, IA, and OH.",
    "relevance_tags": ["tech_company_funding", "data_centers", "electrical_training", "google"],
    "confidence": 0.85,
    "retrieved_at": "2025-12-29T06:00:00Z",
    "published_date": "2024-10-05",
    "content_hash": null,
    "archive_path": null,
    "created_at": "2025-12-29T06:00:00Z",
    "updated_at": "2025-12-29T06:00:00Z"
  },
  {
    "evidence_id": "ev_5d6e7f8a9b0c1d2e",
    "source_url": "https://dceo.illinois.gov/news/2024-workforce-grants",
    "title": "Illinois DCEO Awards $8.2 Million in Workforce Training Grants",
    "excerpt": "The Illinois Department of Commerce and Economic Opportunity announced $8.2 million in workforce training grants, with $3.1 million designated for electrical and construction trades. Grant recipients include JATCs, community colleges, and private training providers.",
    "summary": "Illinois state funding for electrical training programs across the state.",
    "relevance_tags": ["state_funding", "illinois", "electrical_training", "DCEO"],
    "confidence": 0.90,
    "retrieved_at": "2025-12-29T06:00:00Z",
    "published_date": "2024-09-15",
    "content_hash": null,
    "archive_path": null,
    "created_at": "2025-12-29T06:00:00Z",
    "updated_at": "2025-12-29T06:00:00Z"
  },
  {
    "evidence_id": "ev_4e7f8a9b0c1d2e3f",
    "source_url": "https://www.ibew.org/media-center/Articles/24Daily/2411/241115_Apprenticeship",
    "title": "IBEW-NECA Electrical Training Alliance Receives Federal Recognition",
    "excerpt": "The Electrical Training Alliance, jointly operated by IBEW and NECA, received recognition from the Department of Labor for its model apprenticeship curriculum serving over 300,000 apprentices nationwide.",
    "summary": "IBEW-NECA training programs receive federal endorsement, may unlock additional funding.",
    "relevance_tags": ["union_training", "IBEW", "NECA", "apprenticeship", "DOL"],
    "confidence": 0.87,
    "retrieved_at": "2025-12-29T06:00:00Z",
    "published_date": "2024-11-15",
    "content_hash": null,
    "archive_path": null,
    "created_at": "2025-12-29T06:00:00Z",
    "updated_at": "2025-12-29T06:00:00Z"
  },
  {
    "evidence_id": "ev_3f8a9b0c1d2e4f5a",
    "source_url": "https://www.datacenterdynamics.com/en/news/electrician-shortage-threatens-data-center-expansion/",
    "title": "Electrician Shortage Threatens Data Center Expansion Plans",
    "excerpt": "Industry analysts warn that a critical shortage of licensed electricians could delay data center construction by 12-18 months. Major hyperscalers including Google, Microsoft, and Amazon are competing for limited skilled labor.",
    "summary": "Industry report documents electrician shortage impacting data center buildout timeline.",
    "relevance_tags": ["shortage_crisis", "data_centers", "industry_analysis"],
    "confidence": 0.82,
    "retrieved_at": "2025-12-29T06:00:00Z",
    "published_date": "2024-12-01",
    "content_hash": null,
    "archive_path": null,
    "created_at": "2025-12-29T06:00:00Z",
    "updated_at": "2025-12-29T06:00:00Z"
  }
]
